{
  "$schema": "http://json-schema.org/draft-07/schema#",
  "title": "Agent",
  "description": "Agent definition in Nova AI Studio",
  "type": "object",
  "required": ["id", "name", "version", "description", "capabilities"],
  "properties": {
    "id": {
      "type": "string",
      "description": "Unique agent identifier (kebab-case)"
    },
    "name": {
      "type": "string",
      "description": "Human-readable agent name"
    },
    "version": {
      "type": "string",
      "pattern": "^\\d+\\.\\d+\\.\\d+$"
    },
    "description": {
      "type": "string"
    },
    "capabilities": {
      "type": "array",
      "items": { "type": "string" }
    },
    "inputs": {
      "type": "array",
      "items": { "type": "string" }
    },
    "outputs": {
      "type": "array",
      "items": { "type": "string" }
    },
    "dependencies": {
      "type": "array",
      "items": { "type": "string" }
    },
    "tools": {
      "type": "array",
      "items": { "type": "string" }
    },
    "memory": {
      "type": "object",
      "properties": {
        "type": { "type": "string", "enum": ["project", "agent", "knowledge"] },
        "scope": { "type": "string" }
      }
    }
  }
}
